{
  "schemaVersion": 1,
  "frameworkSource": "catalogue",
  "groups": {
    "interaction": "Describes the operations available to a programmer and the sequence between editing a program, executing it, inspecting its state, and turning a concrete result into reusable code.",
    "notation": "Describes the representations a programming system exposes and the relationships among source text, documents, visual interfaces, and executable structures.",
    "structure": "Describes the concepts used to organize a system and the rules for combining, sharing, or extending those concepts.",
    "customizability": "Describes when a system can be changed, which parts can be addressed independently, and whether changes can be made using the system itself.",
    "complexity": "Describes how work is divided among explicit program text, reusable libraries, language rules, tools, and runtime inference.",
    "errors": "Describes when a problem is detected and what the system does after detection as separate design choices.",
    "adoptability": "Describes the technical and social conditions that affect learning, sharing, maintenance, interoperability, and long-term use."
  },
  "dimensions": {
    "feedback": {
      "description": "A feedback loop is the complete sequence from changing a program to observing the consequences of that change. Relevant properties include latency, the number of manual actions required, which intermediate values are visible, and whether a displayed result can be associated with the program version that produced it.",
      "mech": "Mech evaluates dependency-connected values in a resident session. A host can supply an input through a declared context, and values that depend on that input can be written back to the host during the same running session. The current architecture supplies stable program and instance boundaries; the usability and latency of a complete editing interface still need direct measurement.",
      "example": {
        "title": "A browser input updates dependent Mech values",
        "code": "+> @browser := browser/dom\n\nname := @browser/body/content/mech-sandbox/input/_value\ngreeting := \"Hello, \" + name\n@browser/body/content/mech-sandbox/title = greeting",
        "note": "The input, derived value, and browser output are connected explicitly in the program.",
        "source": "https://github.com/mech-lang/mech/blob/c00104a4037b05552bcc226dbc0046ab4ef7cebb/examples/browser-dom-demo/demo.mec"
      }
    },
    "modes": {
      "description": "Modes of interaction are the distinct contexts in which a program can be edited, executed, inspected, or deployed. A system may expose different operations in an authoring document, a resident runtime, an embedded host, and a packaged application even when those contexts share the same language semantics.",
      "mech": "Mech separates source compilation, resident execution, and host integration. Host contexts declare the operations and paths available to a program. A deployed host can therefore expose selected inputs and outputs without granting the same authority as an authoring environment.",
      "example": {
        "title": "A resident program reads from a timer and writes to a console",
        "code": "@timer := timer://timer/tick{:read(tick)}\n@out := console://console/output{:write(line)}\n\ntick := @timer/tick\n@out/line <- tick",
        "note": "The resource declarations state which operations are available in this execution context.",
        "source": "https://github.com/mech-lang/mech/blob/c00104a4037b05552bcc226dbc0046ab4ef7cebb/tests/fixtures/standard-live-timer/live.mec"
      }
    },
    "abstraction": {
      "description": "Abstraction construction is the process of turning a concrete program fragment into a reusable definition. The dimension includes how parameters are identified, how state is handled, whether intermediate values remain inspectable, and how much rewriting is required.",
      "mech": "Mech supports named functions and state-machine forms. The language can express a reusable definition directly, but automatic extraction of a working document fragment into a reusable component is not yet treated here as an established feature.",
      "example": {
        "title": "A recursive function introduces a reusable boundary",
        "code": "factorial(n<f64>) => <f64>\n  ├ 0 => 1\n  └ n => n * factorial(n - 1).\n\nn := 5\nres := factorial(n)",
        "note": "The function signature makes the input and result type explicit.",
        "source": "https://github.com/mech-lang/mech/blob/c00104a4037b05552bcc226dbc0046ab4ef7cebb/examples/working/factorial.mec"
      }
    },
    "notational-structure": {
      "description": "Notational structure describes how multiple notations coexist. They may cover different concerns, such as prose and executable expressions, or provide overlapping views of the same program state. Overlapping editable views require a clear rule for which representation is authoritative.",
      "mech": "A Mech document can contain prose, equations, diagrams, tables, and executable Mech expressions. Executable expressions define computation; the surrounding document explains or presents it. General bidirectional visual editing is not assumed.",
      "example": {
        "title": "Executable definitions can appear inside a Mech document",
        "code": "x := 1..=100\n~y<[string]> := 1..=100\n\nix3 := (x % 3) == 0\nix5 := (x % 5) == 0\n\ny[ix3] = \"✨\"\ny[ix5] = \"🐝\"",
        "note": "The surrounding document explains the example; these lines define its executable values.",
        "source": "https://github.com/mech-lang/mech/blob/c00104a4037b05552bcc226dbc0046ab4ef7cebb/examples/working/fizzbuzz.mec"
      }
    },
    "surface": {
      "description": "Surface and internal notation concerns the mapping from what a programmer edits to the structures that are compiled and executed. The mapping matters for diagnostics, inspection, refactoring, and the identity of values across program updates.",
      "mech": "Mech distinguishes source documents, semantic program artifacts, activated runtime plans, and live instances. Host paths and named values provide source-level references, while runtime storage remains an implementation detail.",
      "example": {
        "title": "A source-level path names a host value",
        "code": "+> @browser := browser/dom\n\nname := @browser/body/content/mech-sandbox/input/_value\n@browser/body/content/mech-sandbox/output/_value = name",
        "note": "The browser path is part of the program-facing interface rather than a storage address.",
        "source": "https://github.com/mech-lang/mech/blob/c00104a4037b05552bcc226dbc0046ab4ef7cebb/examples/browser-dom-demo/demo.mec"
      }
    },
    "primary": {
      "description": "Primary and secondary notations describe whether one notation defines the program while others annotate, configure, or display it, or whether several notations have equal authority. The distinction determines what an edit means and how conflicting edits are resolved.",
      "mech": "Mech source remains the executable definition. Mechdown contributes document structure, and annotations such as a compute-region heading can add operational meaning. Host configuration grants authority separately from the program’s request for a resource.",
      "example": {
        "title": "A section annotation declares a compute boundary",
        "code": "particle-field @compute\n-------------------------------------------------------------------------------\n\nparticle-count := 1000000f32\nparticle-index := 1f32..=particle-count",
        "note": "The heading annotation changes how the enclosed Mech source is compiled and hosted.",
        "source": "https://github.com/mech-lang/mech/blob/c00104a4037b05552bcc226dbc0046ab4ef7cebb/examples/gpu-particles/particles.mec"
      }
    },
    "geography": {
      "description": "Expression geography compares distance in the written program with distance in behavior. A small textual change may affect one local value or many downstream computations; a visually distant edit may refer to the same underlying definition.",
      "mech": "Mech expressions define a dependency graph, so changing a definition can update all dependent values. Logical indexing can also apply one compact expression to many elements. Tooling therefore needs to show the affected dependency region, not infer impact from line distance alone.",
      "example": {
        "title": "One index expression changes many selected elements",
        "code": "ix3 := (x % 3) == 0\nix5 := (x % 5) == 0\n\ny[ix3] = \"✨\"\ny[ix5] = \"🐝\"\ny[ix3 && ix5] = \"✨🐝\"",
        "note": "The written change is local while its effect is distributed across a vector.",
        "source": "https://github.com/mech-lang/mech/blob/c00104a4037b05552bcc226dbc0046ab4ef7cebb/examples/working/fizzbuzz.mec"
      }
    },
    "uniformity": {
      "description": "Uniformity of notation describes how many distinct forms and concepts are required for similar operations. Greater uniformity can reduce the number of special cases, but a single universal form can obscure meaningful differences among values or operations.",
      "mech": "Mech uses the same definition and expression forms across scalars, vectors, and matrices where the operation supports them. Shape, orientation, state, constraints, and external effects remain explicit distinctions rather than being collapsed into one form.",
      "example": {
        "title": "One operation applies to several numeric shapes",
        "code": "scalar := math/add(2, 5)\nvector := math/add([1, 2, 3], [4, 5, 6])\nmatrix := math/add([1, 2; 3, 4], 10)",
        "note": "The operation name is uniform while input shape remains part of its meaning.",
        "source": "https://github.com/mech-lang/mech/blob/c00104a4037b05552bcc226dbc0046ab4ef7cebb/machines/math/docs/ops/add.mec"
      }
    },
    "integrity": {